ID,text,answer,difficulty_ID,topic_ID,group_ID
35bddbe4-ab3b-ee54-e6e6-81ec071bde80,Know the batch request body aspects:/n  0) ChangeSet.  1) Referencing requests in Change Set (Content-ID).,,92c927a9-c302-30ed-60be-9d150e19ba18,a2692f42-63d2-fa84-98fc-7273cbb0e056,25da02e3-55dd-112d-f6bd-efd3c5d17195
7618dce9-a131-553a-9ac9-616f8c6e4879,Know the format of a batch response:/n  0) Headers.  1) Body.,,92c927a9-c302-30ed-60be-9d150e19ba18,a2692f42-63d2-fa84-98fc-7273cbb0e056,25da02e3-55dd-112d-f6bd-efd3c5d17195
0bc32949-766d-5c79-f01c-dc5555c76070,Know how the batch processing works in depth./n,,305ae917-827f-c61a-7b1f-048f91566865,a2692f42-63d2-fa84-98fc-7273cbb0e056,25da02e3-55dd-112d-f6bd-efd3c5d17195
36d7e444-e361-838f-316a-6df527bf6ba9,Know how BE processes change sets./n,,305ae917-827f-c61a-7b1f-048f91566865,a2692f42-63d2-fa84-98fc-7273cbb0e056,25da02e3-55dd-112d-f6bd-efd3c5d17195
002d07e1-0430-fcff-ca04-66aa0ff17693,Know how the primitive types are represented./n,,ada90e4e-7353-4533-f414-c329f3a0f8f0,a2692f42-63d2-fa84-98fc-7273cbb0e056,8a755d41-e354-177e-9c3f-35253f590dab
7eb4b317-1fa2-4731-fa16-d88d37793c76,Know how the collections of entries are represented (formatted):/n  0) “d” property.  1) “results” property.  2) “__count” property.  3) “__next” property.,,ada90e4e-7353-4533-f414-c329f3a0f8f0,a2692f42-63d2-fa84-98fc-7273cbb0e056,8a755d41-e354-177e-9c3f-35253f590dab
5ac64f8a-2ce7-0681-de53-0d827faacd6b,"Know how the individual entries are represented:/n  0) __metadata, uri, type, etag properties.",,ada90e4e-7353-4533-f414-c329f3a0f8f0,a2692f42-63d2-fa84-98fc-7273cbb0e056,8a755d41-e354-177e-9c3f-35253f590dab
d8604584-385e-6a1e-a111-59d919dfde76,Know how the property values are represented./n,,ada90e4e-7353-4533-f414-c329f3a0f8f0,a2692f42-63d2-fa84-98fc-7273cbb0e056,8a755d41-e354-177e-9c3f-35253f590dab
c871ee87-eecb-8749-fa2d-3f186bdfcc1c,Know how the сomplex types properties are represented./n,,ada90e4e-7353-4533-f414-c329f3a0f8f0,a2692f42-63d2-fa84-98fc-7273cbb0e056,8a755d41-e354-177e-9c3f-35253f590dab
0e587a80-7f56-e61c-07f9-416e9f2b94a6,Know how the raw value of a property is represented./n,,ada90e4e-7353-4533-f414-c329f3a0f8f0,a2692f42-63d2-fa84-98fc-7273cbb0e056,8a755d41-e354-177e-9c3f-35253f590dab
e598022d-fefe-57e8-31b1-08fb67436524,"Know what is a “deferred” content, know when the property is added to the response./n",,92c927a9-c302-30ed-60be-9d150e19ba18,a2692f42-63d2-fa84-98fc-7273cbb0e056,8a755d41-e354-177e-9c3f-35253f590dab
a6bebfc1-16f9-332b-b8c1-6c0cbe5452f7,Know how the inline representation ofundefinedassociated entries is constructed./n,,92c927a9-c302-30ed-60be-9d150e19ba18,a2692f42-63d2-fa84-98fc-7273cbb0e056,8a755d41-e354-177e-9c3f-35253f590dab
6030b78b-c1b6-182b-b0c5-de82e87598ca,Know how the links are represented./n,,92c927a9-c302-30ed-60be-9d150e19ba18,a2692f42-63d2-fa84-98fc-7273cbb0e056,8a755d41-e354-177e-9c3f-35253f590dab
ac376d5e-7205-40d9-1207-6b80b2932395,Know how the results from service operations are represented./n,,92c927a9-c302-30ed-60be-9d150e19ba18,a2692f42-63d2-fa84-98fc-7273cbb0e056,8a755d41-e354-177e-9c3f-35253f590dab
5a82bc49-ef9a-955c-8647-04649137a577,Understand how the concurrency control is implemented. Know the purpose of ETags. Be aware of optimistic locking./n,,305ae917-827f-c61a-7b1f-048f91566865,a2692f42-63d2-fa84-98fc-7273cbb0e056,cfbcb3ae-b524-dac2-06c3-d3bcb721f0d7
ed0cbabe-d852-e9b5-ca09-1711fb00ce38,Be aware how the method tunneling through POST is implemented./n,,305ae917-827f-c61a-7b1f-048f91566865,a2692f42-63d2-fa84-98fc-7273cbb0e056,cfbcb3ae-b524-dac2-06c3-d3bcb721f0d7
8b858c92-57ac-c924-333a-c79963a164d9,Awareness of EDM (entity data model) terms:/n  0) Collection.  1) Entry.  2) Property of an entry.  3) Complex Type.  4) Link.  5) Service Operation.,,92c927a9-c302-30ed-60be-9d150e19ba18,187cdceb-62f6-18b0-1fa7-f74b2b96e2e6,153ed1a7-8d71-1154-31d4-bdf961353fd9
29f0a01b-54a9-d902-7b52-f446e36202b3,Know the newly added primitive data types./n,,92c927a9-c302-30ed-60be-9d150e19ba18,187cdceb-62f6-18b0-1fa7-f74b2b96e2e6,153ed1a7-8d71-1154-31d4-bdf961353fd9
60755c37-7128-a495-9f1d-1bf3c1794c79,Know the data representation formats./n,,92c927a9-c302-30ed-60be-9d150e19ba18,187cdceb-62f6-18b0-1fa7-f74b2b96e2e6,153ed1a7-8d71-1154-31d4-bdf961353fd9
ed5f5c61-d759-f23c-4407-c6aa9d40bc5f,Know how the annotations are supplied along with the data model./n,,92c927a9-c302-30ed-60be-9d150e19ba18,187cdceb-62f6-18b0-1fa7-f74b2b96e2e6,153ed1a7-8d71-1154-31d4-bdf961353fd9
604b4c07-ed77-9865-a568-1beae865907a,Know the structural types:/n  0) Primitive Type.  1) Complex Type.  2) Enumeration Type.  3) A collection of one of the above.,,92c927a9-c302-30ed-60be-9d150e19ba18,187cdceb-62f6-18b0-1fa7-f74b2b96e2e6,153ed1a7-8d71-1154-31d4-bdf961353fd9
dee5e6a6-578f-4558-d7cd-410cfab421bd,"Be aware of type definition, underlying primitive type./n",,92c927a9-c302-30ed-60be-9d150e19ba18,187cdceb-62f6-18b0-1fa7-f74b2b96e2e6,153ed1a7-8d71-1154-31d4-bdf961353fd9
9c200c07-32a4-cf02-2428-d17f2d7b8664,Be aware of an entity container members:/n  0) Extending an Entity Container.  1) EntitySet.  2) Singleton.  3) Navigation Property Binding:  4) Action Import.  5) Function Import.,,92c927a9-c302-30ed-60be-9d150e19ba18,187cdceb-62f6-18b0-1fa7-f74b2b96e2e6,153ed1a7-8d71-1154-31d4-bdf961353fd9
851ad39a-84b3-92e7-8803-81c6516b948e,Know the type facets:/n  0) Nullable  1) MaxLength  2) Precision  3) Scale  4) Unicode  5) SRID  6) DefaultValue,,305ae917-827f-c61a-7b1f-048f91566865,187cdceb-62f6-18b0-1fa7-f74b2b96e2e6,153ed1a7-8d71-1154-31d4-bdf961353fd9
b903376c-6149-e5a2-0a5c-9e091a27e16b,Know the kinds of a complex type:/n  0) Derived Complex Type.  1) Abstract Complex Type.  2) Open ComplexType.,,305ae917-827f-c61a-7b1f-048f91566865,187cdceb-62f6-18b0-1fa7-f74b2b96e2e6,153ed1a7-8d71-1154-31d4-bdf961353fd9
9fd15271-a655-be80-21f7-99c37c6f5cab,Know the aspects of navigation property:/n  0) Type.  1) Nullable.  2) Partner.  3) ContainsTarget.  4) ReferentialConstraint.  5) Action on delete:  6) Containment Navigation Property.,,305ae917-827f-c61a-7b1f-048f91566865,187cdceb-62f6-18b0-1fa7-f74b2b96e2e6,153ed1a7-8d71-1154-31d4-bdf961353fd9
2a74712e-1a1c-bd91-b112-ee45ee1d3497,Know the aspects of an enumeration type:/n  0) Underlying Integer Type.  1) Flags Enumeration Type.  2) Enumeration Type Member.,,305ae917-827f-c61a-7b1f-048f91566865,187cdceb-62f6-18b0-1fa7-f74b2b96e2e6,153ed1a7-8d71-1154-31d4-bdf961353fd9
8cf0ba53-557a-f57a-370b-6abac9666572,Be aware of aspects of actions and functions:/n  0) Actions:  1) Functions:  2) Bound / Unbound Action or Function Overloads.  3) Entity Set Path.  4) Return Type.,,aa885dc1-b321-f8bb-b442-fb1b99ec8fd6,187cdceb-62f6-18b0-1fa7-f74b2b96e2e6,153ed1a7-8d71-1154-31d4-bdf961353fd9
2ae576ba-f6cf-1b2a-c519-4c78cf69eeca,Know what is a “Term”:/n  0) Specialized Term.  1) Applicability.,,92c927a9-c302-30ed-60be-9d150e19ba18,187cdceb-62f6-18b0-1fa7-f74b2b96e2e6,e3daa338-65a3-27b2-a611-1a1f11c8227c
4a037765-60ab-2b57-a92d-48889b35f7b4,Know what is an “Annotation” and its:/n  0) Qualifier.  1) Target.,,92c927a9-c302-30ed-60be-9d150e19ba18,187cdceb-62f6-18b0-1fa7-f74b2b96e2e6,e3daa338-65a3-27b2-a611-1a1f11c8227c
4b61eb57-01dc-0fa9-a905-0b7177754816,Be aware of constant expressions:/n  0) Binary.  1) Boolean.  2) Date.  3) DateTmeOffset.  4) Decimal.  5) Duration.  6) Enumeration Member.  7) Floating-Point Number.  8) Guid.  9) Integer.  10) String.  11) Time of Day.,,92c927a9-c302-30ed-60be-9d150e19ba18,187cdceb-62f6-18b0-1fa7-f74b2b96e2e6,e3daa338-65a3-27b2-a611-1a1f11c8227c
9208d587-d553-6c9a-6c60-8135a6324f98,Be aware of dynamic expressions:/n  0) Path Expressions:  1) Comparison & Logical Operators:  2) Arithmetic Operators.  3) Apply Client-side Function:  4) Cast.  5) Collection.  6) If-Then-Else.  7) Is-Of.  8) Labeled Element.  9) Labeled Element Reference.  10) Null.  11) Record.  12) URL Reference.,,305ae917-827f-c61a-7b1f-048f91566865,187cdceb-62f6-18b0-1fa7-f74b2b96e2e6,e3daa338-65a3-27b2-a611-1a1f11c8227c
6f0c42f2-4b3d-9734-3fd3-4fffd3cc271a,$search./n,,92c927a9-c302-30ed-60be-9d150e19ba18,187cdceb-62f6-18b0-1fa7-f74b2b96e2e6,787efcf4-7a3c-babc-9736-8025b7e066a1
320d0dce-3ce9-a213-5641-77c8ebd49fa2,$compute./n,,92c927a9-c302-30ed-60be-9d150e19ba18,187cdceb-62f6-18b0-1fa7-f74b2b96e2e6,787efcf4-7a3c-babc-9736-8025b7e066a1
d0292daf-f616-74ef-ca4c-60c863468c60,$index./n,,92c927a9-c302-30ed-60be-9d150e19ba18,187cdceb-62f6-18b0-1fa7-f74b2b96e2e6,787efcf4-7a3c-babc-9736-8025b7e066a1
aa6ecced-a33d-7cda-0c3e-6e6d786e57e8,$schemaversion./n,,92c927a9-c302-30ed-60be-9d150e19ba18,187cdceb-62f6-18b0-1fa7-f74b2b96e2e6,787efcf4-7a3c-babc-9736-8025b7e066a1
bab0df0f-6648-51de-b4ff-f369bb33c4fe,Lambda Operators./n,,92c927a9-c302-30ed-60be-9d150e19ba18,187cdceb-62f6-18b0-1fa7-f74b2b96e2e6,787efcf4-7a3c-babc-9736-8025b7e066a1
ba28928a-3686-6046-4092-4a5bea08aaed,Be aware of filtering parent entities by children./n,,92c927a9-c302-30ed-60be-9d150e19ba18,187cdceb-62f6-18b0-1fa7-f74b2b96e2e6,787efcf4-7a3c-babc-9736-8025b7e066a1
fa50c2bc-ea2e-6b5f-40d0-d7c0300da0a9,Know the entity types kinds:/n  0) Derived Entity Type.  1) Abstract Entity Type.  2) Open Entity Type.  3) Media Entity Type.  4) Open Type.,,305ae917-827f-c61a-7b1f-048f91566865,187cdceb-62f6-18b0-1fa7-f74b2b96e2e6,4899f762-bbc9-da3f-f839-8b6a9b639479
530d1ee1-8bc0-7e32-e112-f0f543a3dab6,Know the attribute-styled annotations:/n  0) IsDefaultEntityContainer  1) DataServiceVersion  2) HasStream  3) MimeType  4) HttpMethod,,305ae917-827f-c61a-7b1f-048f91566865,187cdceb-62f6-18b0-1fa7-f74b2b96e2e6,4899f762-bbc9-da3f-f839-8b6a9b639479
8298eebd-1251-bacd-654a-f0b385069104,Know the standard folder structure of the SAPUI5 app./n,,ada90e4e-7353-4533-f414-c329f3a0f8f0,f3a57544-58fa-9af8-761e-266368ff68d4,61c45a3e-9f84-fae8-57e1-62b576c4306f
3a9e639b-350a-54ec-59a8-e60aee4aebb1,Know the aspects of Component & Manifest:/n  0) Component definition.  1) Manifest structure.,,ada90e4e-7353-4533-f414-c329f3a0f8f0,f3a57544-58fa-9af8-761e-266368ff68d4,61c45a3e-9f84-fae8-57e1-62b576c4306f
a5a93b6c-dd6a-db5b-1e5e-779a39f6312d,Be aware of UI5 framework versioning system: major/minor/patch versions/n,,ada90e4e-7353-4533-f414-c329f3a0f8f0,f3a57544-58fa-9af8-761e-266368ff68d4,61c45a3e-9f84-fae8-57e1-62b576c4306f
81577d26-1d7f-0580-b6e4-f993b886e24c,Know the different ways of app bootstrapping:/n  0) Standalone app.  1) flpSandbox app.  2) flpMockServer app.  3) unit/OPA test run app.  4) CDN/local sdk references.,,92c927a9-c302-30ed-60be-9d150e19ba18,f3a57544-58fa-9af8-761e-266368ff68d4,61c45a3e-9f84-fae8-57e1-62b576c4306f
ed57a6f0-dea2-c7e3-3702-88e410b64810,Know the configuration options and URL parameters of the app./n,,92c927a9-c302-30ed-60be-9d150e19ba18,f3a57544-58fa-9af8-761e-266368ff68d4,61c45a3e-9f84-fae8-57e1-62b576c4306f
27819bd3-124d-97f7-7f31-4fd654e8e857,Know how the app gets initialized. Be able to explain each step in the init flow./n,,305ae917-827f-c61a-7b1f-048f91566865,f3a57544-58fa-9af8-761e-266368ff68d4,61c45a3e-9f84-fae8-57e1-62b576c4306f
da5d3787-6f4a-8242-8f6b-f921e7f9cd8d,"Understand what is a Data Binding, it’s purpose and why it is so important./n",,ada90e4e-7353-4533-f414-c329f3a0f8f0,f3a57544-58fa-9af8-761e-266368ff68d4,b8125665-e4bd-5286-6eee-216e4400e53d
020b3b41-9114-e9c4-c744-0c6d425daa1a,Know the Property Binding mechanism./n,,ada90e4e-7353-4533-f414-c329f3a0f8f0,f3a57544-58fa-9af8-761e-266368ff68d4,b8125665-e4bd-5286-6eee-216e4400e53d
8fb5e50d-a6c1-f72f-2fe2-9e7a17da5f2f,"Know the Aggregation Binding mechanism:/n  0) Know the Filtering, Sorting, Grouping capabilities:",,ada90e4e-7353-4533-f414-c329f3a0f8f0,f3a57544-58fa-9af8-761e-266368ff68d4,b8125665-e4bd-5286-6eee-216e4400e53d
dbce119e-8cb3-848d-d026-749681768ba4,Know the Element/Object binding mechanism./n,,ada90e4e-7353-4533-f414-c329f3a0f8f0,f3a57544-58fa-9af8-761e-266368ff68d4,b8125665-e4bd-5286-6eee-216e4400e53d
642102ab-c2dd-55f2-5e6c-d5dc6ecadeba,Know what is a Binding Context./n,,ada90e4e-7353-4533-f414-c329f3a0f8f0,f3a57544-58fa-9af8-761e-266368ff68d4,b8125665-e4bd-5286-6eee-216e4400e53d
01247d7a-2dd1-792b-339a-0c947d8e6879,Know what is a Formatter function and when to use it./n,,ada90e4e-7353-4533-f414-c329f3a0f8f0,f3a57544-58fa-9af8-761e-266368ff68d4,b8125665-e4bd-5286-6eee-216e4400e53d
58374146-2742-e6bb-604c-7c0738b5d804,"Know what is a DataType, its purpose and how & when to use it:/n  0) Be aware of all the Simple Data Typesundefined  1) Be aware of the Formatter Classes and when to use them:",,ada90e4e-7353-4533-f414-c329f3a0f8f0,f3a57544-58fa-9af8-761e-266368ff68d4,b8125665-e4bd-5286-6eee-216e4400e53d
437679d2-2cfd-c12b-6453-e36fd8d1e1a9,"Know the 3 available Binding Modes. Be able to explain each of them, their purpose and when to use:/n  0) OneWay.  1) TwoWay.  2) OneTime.",,ada90e4e-7353-4533-f414-c329f3a0f8f0,f3a57544-58fa-9af8-761e-266368ff68d4,b8125665-e4bd-5286-6eee-216e4400e53d
88c93095-eedb-ffcb-7c6f-caf3e1a76e7e,"Know the data binding syntax:/n  0) Binding path  1) Composite binding  2) Know the expression binding technique and be able to decide when to use the formatter function instead.  3) i18n binding, sap.base.strings.formatMessage",,ada90e4e-7353-4533-f414-c329f3a0f8f0,f3a57544-58fa-9af8-761e-266368ff68d4,b8125665-e4bd-5286-6eee-216e4400e53d
4b1e4ba9-aefd-4c20-5d1b-866e585460c3,Know the standard “binding” attribute of a control./n,,ada90e4e-7353-4533-f414-c329f3a0f8f0,f3a57544-58fa-9af8-761e-266368ff68d4,b8125665-e4bd-5286-6eee-216e4400e53d
51724773-ed71-cb49-ec11-d6833e63073a,Understand the Factory Function concept./n,,92c927a9-c302-30ed-60be-9d150e19ba18,f3a57544-58fa-9af8-761e-266368ff68d4,b8125665-e4bd-5286-6eee-216e4400e53d
c5e805a1-4fee-dc1e-aef1-d076527e2339,Know the possibility of a custom filtering function definition and when it might be useful./n,,92c927a9-c302-30ed-60be-9d150e19ba18,f3a57544-58fa-9af8-761e-266368ff68d4,b8125665-e4bd-5286-6eee-216e4400e53d
88ac49bd-4734-78af-57f6-006aebfe2c40,Know how to use the grouper function./n,,92c927a9-c302-30ed-60be-9d150e19ba18,f3a57544-58fa-9af8-761e-266368ff68d4,b8125665-e4bd-5286-6eee-216e4400e53d
dd5ef6f0-9b04-0c2f-d51a-e856a45e0b00,Know how to create a Custom Data Type. Understand the reason why it might be required./n,,92c927a9-c302-30ed-60be-9d150e19ba18,f3a57544-58fa-9af8-761e-266368ff68d4,b8125665-e4bd-5286-6eee-216e4400e53d
3625c43f-fd58-d259-0437-ca550b04c7ea,Know the binding techniques of a MetaModel./n,,92c927a9-c302-30ed-60be-9d150e19ba18,f3a57544-58fa-9af8-761e-266368ff68d4,b8125665-e4bd-5286-6eee-216e4400e53d
75274548-34a4-42e9-ff64-d9ccce4ce924,Understand templateShareable concept./n,,305ae917-827f-c61a-7b1f-048f91566865,f3a57544-58fa-9af8-761e-266368ff68d4,b8125665-e4bd-5286-6eee-216e4400e53d
d0ec6f18-5bce-216b-7d5e-1a9369b05f27,Understand the lifecycle of binding templates./n,,305ae917-827f-c61a-7b1f-048f91566865,f3a57544-58fa-9af8-761e-266368ff68d4,b8125665-e4bd-5286-6eee-216e4400e53d
7eb7dfa2-ea2a-01ca-940f-b39d24cc73aa,Understand the extended change detection mechanism./n,,305ae917-827f-c61a-7b1f-048f91566865,f3a57544-58fa-9af8-761e-266368ff68d4,b8125665-e4bd-5286-6eee-216e4400e53d
0a52114e-6193-4710-558a-80a930ebce04,Know how the data binding works on the level of source code./n,,aa885dc1-b321-f8bb-b442-fb1b99ec8fd6,f3a57544-58fa-9af8-761e-266368ff68d4,b8125665-e4bd-5286-6eee-216e4400e53d
f1846b12-7f99-ce44-af43-3b10a3fef362,"Understand the aspects of controls usage in XML format:/n  0) What is a namespace? Declare / import the libs through the namespaces.  1) Ability to use default namespace & named namespace. Prefixing controls in the view.  2) What is XML Node? Its definition syntax.  3) What are the attributes & events. Their purpose & syntax.  4) What is aggregation? Its purpose & syntax.  5) Default aggregations feature.  6) What is association? Its purpose & syntax.  7) What is dependent. Its purpose & syntax.  8) Icons definition syntax.  9) “class” attribute specifics, one time set-up.",,ada90e4e-7353-4533-f414-c329f3a0f8f0,f3a57544-58fa-9af8-761e-266368ff68d4,00707a3e-0c2b-06e5-4af3-e6d23c86fb7c
aca69eaa-c390-5e26-5fb1-80ea41b9d11f,Know the predefined CSS classes./n,,ada90e4e-7353-4533-f414-c329f3a0f8f0,f3a57544-58fa-9af8-761e-266368ff68d4,00707a3e-0c2b-06e5-4af3-e6d23c86fb7c
0b163021-d4b4-9f93-e291-5308463080ea,Know how to instantiate control via JS./n,,ada90e4e-7353-4533-f414-c329f3a0f8f0,f3a57544-58fa-9af8-761e-266368ff68d4,00707a3e-0c2b-06e5-4af3-e6d23c86fb7c
d16e5408-64aa-9843-ecbc-449dec2b8954,Be aware of guidelines from documentation for  and /n,,ada90e4e-7353-4533-f414-c329f3a0f8f0,f3a57544-58fa-9af8-761e-266368ff68d4,00707a3e-0c2b-06e5-4af3-e6d23c86fb7c
7c3a7437-4320-044a-b7d3-ad1c2f22a007,Know what is Custom Data and when to use it:/n,,92c927a9-c302-30ed-60be-9d150e19ba18,f3a57544-58fa-9af8-761e-266368ff68d4,00707a3e-0c2b-06e5-4af3-e6d23c86fb7c
23a4223d-c80c-f142-9ed5-cb811b96ba56,Syntax while binding./n,,92c927a9-c302-30ed-60be-9d150e19ba18,f3a57544-58fa-9af8-761e-266368ff68d4,00707a3e-0c2b-06e5-4af3-e6d23c86fb7c
e719b222-8c1f-d366-ddd9-04b67715a7ef,Know how to get it in the controller./n,,92c927a9-c302-30ed-60be-9d150e19ba18,f3a57544-58fa-9af8-761e-266368ff68d4,00707a3e-0c2b-06e5-4af3-e6d23c86fb7c
26350738-5be4-eaf7-0af1-aee212d53f59,Know how to write it to DOM and when it might be useful./n,,92c927a9-c302-30ed-60be-9d150e19ba18,f3a57544-58fa-9af8-761e-266368ff68d4,00707a3e-0c2b-06e5-4af3-e6d23c86fb7c
cdd81683-1c08-0f6c-65ba-9ebb0ca94d72,"Know the Field Groups concept, their purpose & common use cases./n",,92c927a9-c302-30ed-60be-9d150e19ba18,f3a57544-58fa-9af8-761e-266368ff68d4,00707a3e-0c2b-06e5-4af3-e6d23c86fb7c
489edbaa-8564-067b-cf6e-b22d78a2bd60,Control’s functionality expansion via Dependents trick./n,,aa885dc1-b321-f8bb-b442-fb1b99ec8fd6,f3a57544-58fa-9af8-761e-266368ff68d4,00707a3e-0c2b-06e5-4af3-e6d23c86fb7c
f08154b6-273a-b74e-be70-997edf84323b,Be aware of the Custom Controls creation possibility and why it might be required./n,,ada90e4e-7353-4533-f414-c329f3a0f8f0,f3a57544-58fa-9af8-761e-266368ff68d4,c313c8bb-4ebd-6815-41f7-876762fac7c2
6415aa0c-8c8b-fdbf-8c19-ac189804e6f2,Know the various types of custom controls. Ability to decide in which case what type to use./n,,92c927a9-c302-30ed-60be-9d150e19ba18,f3a57544-58fa-9af8-761e-266368ff68d4,c313c8bb-4ebd-6815-41f7-876762fac7c2
67da57eb-b6aa-e134-61b6-90179d8167eb,Know the composite control aspects:/n  0) Syntax.  1) Know Standard Composite syntax & purpose..  2) Know XML Composite syntax & purpose.,,92c927a9-c302-30ed-60be-9d150e19ba18,f3a57544-58fa-9af8-761e-266368ff68d4,c313c8bb-4ebd-6815-41f7-876762fac7c2
94f27f33-3e2e-091a-ee90-1174d7fa4b9f,Know the control extension approach (via inheritance from a standard)./n,,92c927a9-c302-30ed-60be-9d150e19ba18,f3a57544-58fa-9af8-761e-266368ff68d4,c313c8bb-4ebd-6815-41f7-876762fac7c2
fc9914e8-9a7c-15e8-396a-61ecb58857d0,"Know how to create a true custom control:/n  0) Understand control metadata:  1) Ability to implement own custom renderer.  2) Understand the Render Manager mechanism.  3) Know the approach of reusing renderer from existing control.  4) Know the approach of extending renderer from existing control.  5) Know how to declare custom CSS for the new control, guidelines, naming, placement.  6) Know the i18n for control aspects.",,92c927a9-c302-30ed-60be-9d150e19ba18,f3a57544-58fa-9af8-761e-266368ff68d4,c313c8bb-4ebd-6815-41f7-876762fac7c2
ab9f36bb-015a-5970-c86c-20d0b966917e,Know the accessibility aspects to stick to./n,,305ae917-827f-c61a-7b1f-048f91566865,f3a57544-58fa-9af8-761e-266368ff68d4,c313c8bb-4ebd-6815-41f7-876762fac7c2
0400c97e-9a8d-3c8f-bb5e-fa32a6e0b2e2,"Understand Smart Table concepts:/n  0) Annotations:  1) Know how to declare сustom columns.  2) Personalization (column selection, grouping, sorting, filtering).  3) Reference to Smart Filter Bar awareness  4) Variant Management.  5) Know onBeforeRebind event main use cases.",,ada90e4e-7353-4533-f414-c329f3a0f8f0,f3a57544-58fa-9af8-761e-266368ff68d4,78d95ab9-aed0-148c-4110-9fcfb9123f2c
95f6ce08-710d-a41f-1dd0-6fc038d89fe5,Understand Smart Filter Bar concepts:/n  0) Annotations:  1) Know how to declare сustom filter items.  2) “Adapt Filters” feature awareness.  3) Variant Management..  4) “Basic Search” feature awareness.,,ada90e4e-7353-4533-f414-c329f3a0f8f0,f3a57544-58fa-9af8-761e-266368ff68d4,78d95ab9-aed0-148c-4110-9fcfb9123f2c
21451e5c-92c6-a68c-44ea-34c348f2ff7a,"Understand Smart Field concepts:/n  0) We aware of annotations.  1) Know available field types.  2) Know the Value Help concept, its configuration.  3) Know the field control concept, ability to describe the main use cases.",,ada90e4e-7353-4533-f414-c329f3a0f8f0,f3a57544-58fa-9af8-761e-266368ff68d4,78d95ab9-aed0-148c-4110-9fcfb9123f2c
574f2c6e-0090-72f5-c85b-3fef79debe4e,Understand Smart Form concepts:/n  0) Annotations.,,92c927a9-c302-30ed-60be-9d150e19ba18,f3a57544-58fa-9af8-761e-266368ff68d4,78d95ab9-aed0-148c-4110-9fcfb9123f2c
c54205dd-dce7-95d2-0ff0-7307214be36d,Understand Dynamic Field Control concept. Understand UI.Hidden annotation./n,,92c927a9-c302-30ed-60be-9d150e19ba18,f3a57544-58fa-9af8-761e-266368ff68d4,78d95ab9-aed0-148c-4110-9fcfb9123f2c
0a5377ec-70c5-eb7a-9d1c-d6eb53350d47,Know the Side Effects concept of Smart Field control./n,,92c927a9-c302-30ed-60be-9d150e19ba18,f3a57544-58fa-9af8-761e-266368ff68d4,78d95ab9-aed0-148c-4110-9fcfb9123f2c
ace13bd8-1d43-f9c0-23bb-468d82c7803f,Understand Smart Chart concepts/n  0) Annotations,,305ae917-827f-c61a-7b1f-048f91566865,f3a57544-58fa-9af8-761e-266368ff68d4,78d95ab9-aed0-148c-4110-9fcfb9123f2c
83b11200-e8df-cc77-08c7-ff28d38db0db,Understand Smart Link concepts:/n  0) Annotations.  1) Semantic Object Controller.  2) Know the intent based navigation concept.,,305ae917-827f-c61a-7b1f-048f91566865,f3a57544-58fa-9af8-761e-266368ff68d4,78d95ab9-aed0-148c-4110-9fcfb9123f2c
411e06c2-84c2-e484-3aad-0a1f95d5dfc9,"Know the various types of Views:/n  0) XML view syntax.  1) JS View syntax.  2) Know the Fragments concept, its purpose.",,ada90e4e-7353-4533-f414-c329f3a0f8f0,f3a57544-58fa-9af8-761e-266368ff68d4,6a19a1c2-193f-8804-0550-9c2732c98f82
9bf19f3c-29be-aab9-5a19-568a3263bad5,"Know the Controllers aspects:/n  0) Definition syntax.  1) Know how the controller gets attached to a view.  2) Know the lifecycle methods.  3) Understand the inheritance concept. Know the syntax, super methods call.  4) Know the base controller best practice.  5) Know the dialogs reuse approach via custom controller.",,ada90e4e-7353-4533-f414-c329f3a0f8f0,f3a57544-58fa-9af8-761e-266368ff68d4,6a19a1c2-193f-8804-0550-9c2732c98f82
57f53e68-deb0-30df-a7ac-3fbf97855811,"Know the Model aspects:/n  0) Know the available models’ basics:  1) Know where the model can be declared:  2) Know the concept of named and default models. Syntax of referencing to named/default models, syntax for the relative binding in case of named model.",,ada90e4e-7353-4533-f414-c329f3a0f8f0,f3a57544-58fa-9af8-761e-266368ff68d4,6a19a1c2-193f-8804-0550-9c2732c98f82
b43583e8-13d0-914c-e94f-b425e04380c3,Understand how the id’s for the controls are generated in a view./n,,92c927a9-c302-30ed-60be-9d150e19ba18,f3a57544-58fa-9af8-761e-266368ff68d4,6a19a1c2-193f-8804-0550-9c2732c98f82
bc0ae23c-6487-a006-a047-722bae611cfe,Adding controls as dependent./n,,92c927a9-c302-30ed-60be-9d150e19ba18,f3a57544-58fa-9af8-761e-266368ff68d4,6a19a1c2-193f-8804-0550-9c2732c98f82
9858f620-c051-ef88-c44b-aede8700ac50,Be able to compare JS & XML view approaches. Ability to identify the use cases when each of them could be useful or harmful./n,,92c927a9-c302-30ed-60be-9d150e19ba18,f3a57544-58fa-9af8-761e-266368ff68d4,6a19a1c2-193f-8804-0550-9c2732c98f82
54c0cd33-c212-441a-91df-89b83f391d9d,Understand the basic concept of models propagation through the views and controls tree./n,,92c927a9-c302-30ed-60be-9d150e19ba18,f3a57544-58fa-9af8-761e-266368ff68d4,6a19a1c2-193f-8804-0550-9c2732c98f82
d5a8b43c-b6d5-4531-e4d6-aea35584c574,"Know the main model events, derived from sap.ui.model.Model:/n  0) propertyChange.  1) requestCompleted.  2) requestFailed.  3) requestSend.  4) updateBindings.",,92c927a9-c302-30ed-60be-9d150e19ba18,f3a57544-58fa-9af8-761e-266368ff68d4,6a19a1c2-193f-8804-0550-9c2732c98f82
d1103abf-2347-8f64-3529-dd94d8b0ffda,Understand the mechanism of views nesting./n,,305ae917-827f-c61a-7b1f-048f91566865,f3a57544-58fa-9af8-761e-266368ff68d4,6a19a1c2-193f-8804-0550-9c2732c98f82
3896721b-eeb8-1d0b-aee3-1d5c9c2fc7a3,Understand the mechanism of view destruction./n,,305ae917-827f-c61a-7b1f-048f91566865,f3a57544-58fa-9af8-761e-266368ff68d4,6a19a1c2-193f-8804-0550-9c2732c98f82
57e4bc6d-e275-c1fd-e808-a523cfdd0e75,Understand the mechanism of controllers destruction./n,,305ae917-827f-c61a-7b1f-048f91566865,f3a57544-58fa-9af8-761e-266368ff68d4,6a19a1c2-193f-8804-0550-9c2732c98f82
58f280f4-2252-b86c-3000-4098c2a24536,Know the syntax of a module definition in SAPUI5./n,,ada90e4e-7353-4533-f414-c329f3a0f8f0,f3a57544-58fa-9af8-761e-266368ff68d4,eb5c50ac-413a-fe3f-28ce-d434882b1568
a390e146-253f-803a-b3a3-3d631ac00ca0,Know how the module can be consumed./n  0) sap.ui.define at the beginning of a file  1) sap.ui.require in the custom place of a file,,ada90e4e-7353-4533-f414-c329f3a0f8f0,f3a57544-58fa-9af8-761e-266368ff68d4,eb5c50ac-413a-fe3f-28ce-d434882b1568
2b41930e-5bc5-db89-75e0-97ace3bf403f,Understand the AMD concept./n,,92c927a9-c302-30ed-60be-9d150e19ba18,f3a57544-58fa-9af8-761e-266368ff68d4,eb5c50ac-413a-fe3f-28ce-d434882b1568
0febb229-1bdc-071f-7c24-31d6c7d4fbad,Know what is a *-dbg.js version of a module./n,,92c927a9-c302-30ed-60be-9d150e19ba18,f3a57544-58fa-9af8-761e-266368ff68d4,eb5c50ac-413a-fe3f-28ce-d434882b1568
bbb5f823-6959-eca6-3292-62b6e37dbc37,Know how the circular references are resolved./n,,305ae917-827f-c61a-7b1f-048f91566865,f3a57544-58fa-9af8-761e-266368ff68d4,eb5c50ac-413a-fe3f-28ce-d434882b1568
