ID,text,answer,difficulty_ID,topic_ID,group_ID
861d73c9-4119-aa44-85f7-d21afa08ccbe,Understand how the objects-wrappers mechanism works;/n,,305ae917-827f-c61a-7b1f-048f91566865,6954c459-fabf-eae8-1ffb-be7dafe2f377,0a2faa8f-4759-bb8e-31cb-faef97fccf58
c34c9278-c945-29d0-500f-4eaa26811f25,Understand the purpose of Reflect object;/n,,aa885dc1-b321-f8bb-b442-fb1b99ec8fd6,6954c459-fabf-eae8-1ffb-be7dafe2f377,0a2faa8f-4759-bb8e-31cb-faef97fccf58
d33d832d-35e1-8448-0530-c709a8f19c8a,Understand the purpose of Proxy object;/n,,aa885dc1-b321-f8bb-b442-fb1b99ec8fd6,6954c459-fabf-eae8-1ffb-be7dafe2f377,0a2faa8f-4759-bb8e-31cb-faef97fccf58
cc6bcec0-65b6-cbca-91a5-19a8c1e7611c,Understand the purpose of Intl object;/n,,aa885dc1-b321-f8bb-b442-fb1b99ec8fd6,6954c459-fabf-eae8-1ffb-be7dafe2f377,0a2faa8f-4759-bb8e-31cb-faef97fccf58
ff1b6ff7-ef78-14bb-f7c9-7e2aea122e50,Know what is an operand and how many operands the operators can operate with;/n,,92c927a9-c302-30ed-60be-9d150e19ba18,6954c459-fabf-eae8-1ffb-be7dafe2f377,527749a4-26f4-faff-61c9-37087c94af69
57926fe9-d27d-d363-d3e8-de9850ef5f4f,Know the arithmetic operators/n  0) Addition (+)  1) Subtraction (-)  2) Division (/)  3) Multiplication (*)  4) Remainder (%)  5) Exponentiation (**)  6) Increment (++)  7) Decrement (--)  8) Unary negation (-)  9) Unary plus (+),,92c927a9-c302-30ed-60be-9d150e19ba18,6954c459-fabf-eae8-1ffb-be7dafe2f377,527749a4-26f4-faff-61c9-37087c94af69
bfd678cb-baec-bc47-ff30-78319e42bb6f,Know the shorthand assignments;/n,,92c927a9-c302-30ed-60be-9d150e19ba18,6954c459-fabf-eae8-1ffb-be7dafe2f377,527749a4-26f4-faff-61c9-37087c94af69
8f4335ec-19a7-aeaa-611a-dbb33da1f676,"Understand what is eval, how it works and what are the pitfalls and risks it can cause;/n  0) Know the difference between direct and indirect eval calls;  1) Know the safer and faster alternative: new Function;",,92c927a9-c302-30ed-60be-9d150e19ba18,6954c459-fabf-eae8-1ffb-be7dafe2f377,527749a4-26f4-faff-61c9-37087c94af69
c51eadaa-79f0-f78b-1160-052ee4928dfc,Know the comparison operators:/n  0) Equality (==)  1) Inequality (!=)  2) Identity / strict equality (===)  3) Non-identity / strict equality (!==),,92c927a9-c302-30ed-60be-9d150e19ba18,6954c459-fabf-eae8-1ffb-be7dafe2f377,527749a4-26f4-faff-61c9-37087c94af69
7f40e3d3-4651-637e-d70e-d7416e71bc4a,Know the relational operators:/n  0) Greater than(>)  1) Greater than or equal (>=)  2) Less than (<)  3) Less than or equal (<=),,92c927a9-c302-30ed-60be-9d150e19ba18,6954c459-fabf-eae8-1ffb-be7dafe2f377,527749a4-26f4-faff-61c9-37087c94af69
c0eb54c8-6b98-dea4-8865-219f1be46ea9,Know the logical operators:/n  0) Logical AND (&&)  1) Logical OR (||)  2) Logical NOT (!)  3) Short-circuit evaluation  4) Operator precedence  5) Double NOT (!!),,92c927a9-c302-30ed-60be-9d150e19ba18,6954c459-fabf-eae8-1ffb-be7dafe2f377,527749a4-26f4-faff-61c9-37087c94af69
690e2f32-30de-b947-0d2a-eadfa8c1d0a6,Know the conditional (ternary) operator;/n,,92c927a9-c302-30ed-60be-9d150e19ba18,6954c459-fabf-eae8-1ffb-be7dafe2f377,527749a4-26f4-faff-61c9-37087c94af69
98fbf7c1-1460-e72c-27d2-829d50c1dbe0,Know conditional chains by the ternary operator technique;/n,,92c927a9-c302-30ed-60be-9d150e19ba18,6954c459-fabf-eae8-1ffb-be7dafe2f377,527749a4-26f4-faff-61c9-37087c94af69
4a814c8f-32e6-7d7c-6fda-1cb64936070b,Know the grouping operator;/n,,92c927a9-c302-30ed-60be-9d150e19ba18,6954c459-fabf-eae8-1ffb-be7dafe2f377,527749a4-26f4-faff-61c9-37087c94af69
0c89aa2b-a53c-54c2-8c5f-8a7aa56b8d99,Know the destructuring assignment/n  0) Array destructuring possibilities  1) Object destructuring,,92c927a9-c302-30ed-60be-9d150e19ba18,6954c459-fabf-eae8-1ffb-be7dafe2f377,527749a4-26f4-faff-61c9-37087c94af69
01fed190-e5aa-e472-d554-4d77066f4a91,Know the operators precedence;/n,,92c927a9-c302-30ed-60be-9d150e19ba18,6954c459-fabf-eae8-1ffb-be7dafe2f377,527749a4-26f4-faff-61c9-37087c94af69
f765229b-5499-69b5-89d1-eca719b85977,Understand what is operators associativity;/n,,92c927a9-c302-30ed-60be-9d150e19ba18,6954c459-fabf-eae8-1ffb-be7dafe2f377,527749a4-26f4-faff-61c9-37087c94af69
e1e48c4a-590b-daa8-aad6-bd31297c8bfc,Know the “in” operator;/n,,92c927a9-c302-30ed-60be-9d150e19ba18,6954c459-fabf-eae8-1ffb-be7dafe2f377,527749a4-26f4-faff-61c9-37087c94af69
c9b0d46c-1841-9467-546d-72fba42532ef,Know the void operator;/n,,92c927a9-c302-30ed-60be-9d150e19ba18,6954c459-fabf-eae8-1ffb-be7dafe2f377,527749a4-26f4-faff-61c9-37087c94af69
1899bd5b-b269-0a6b-5a45-4de82055f30b,Know the bitwise operators:/n  0) AND (&)  1) OR (|)  2) XOR (^)  3) NOT (~)  4) Left Shift (<<)  5) Sign-propagating right shift (>>)  6) Zero-fill right shift (>>>)  7) Flags & bitwise masks,,305ae917-827f-c61a-7b1f-048f91566865,6954c459-fabf-eae8-1ffb-be7dafe2f377,527749a4-26f4-faff-61c9-37087c94af69
0f1060e5-6209-77f8-2cde-b8ab1f522f10,Understand the Nullish coalescing operator / optional chaining operator;/n,,aa885dc1-b321-f8bb-b442-fb1b99ec8fd6,6954c459-fabf-eae8-1ffb-be7dafe2f377,527749a4-26f4-faff-61c9-37087c94af69
24d3aa52-8ee5-0e0e-6d99-de118d62be85,Know the ways of object initialization:/n  0) new.  1) literal.  2) Object.create.  3) ES2015 notation.  4) Be aware of computed property names feature;.  5) Via function-constructor.,,92c927a9-c302-30ed-60be-9d150e19ba18,6954c459-fabf-eae8-1ffb-be7dafe2f377,b120d1e9-8211-02b0-e355-ebc6d29ea5c2
4ee8e410-95c6-de76-bb5f-b331454d2f9d,Know the accessing properties:/n  0) Dot notation  1) Bracket notation,,92c927a9-c302-30ed-60be-9d150e19ba18,6954c459-fabf-eae8-1ffb-be7dafe2f377,b120d1e9-8211-02b0-e355-ebc6d29ea5c2
55b88b44-3bf6-6a63-4d3a-0e6cb30e9002,Know the property definitions variants:/n  0) defineProperty  1) simple assignment,,92c927a9-c302-30ed-60be-9d150e19ba18,6954c459-fabf-eae8-1ffb-be7dafe2f377,b120d1e9-8211-02b0-e355-ebc6d29ea5c2
d99dc856-4c3e-af2e-d7f7-50222ffb41cc,Know the method definitions variants;/n,,92c927a9-c302-30ed-60be-9d150e19ba18,6954c459-fabf-eae8-1ffb-be7dafe2f377,b120d1e9-8211-02b0-e355-ebc6d29ea5c2
caa7d40f-7261-c800-48a5-fca5261b8be7,"Know how delete operator works, it’s influence on memory management;/n",,92c927a9-c302-30ed-60be-9d150e19ba18,6954c459-fabf-eae8-1ffb-be7dafe2f377,b120d1e9-8211-02b0-e355-ebc6d29ea5c2
f20fda13-10ec-ed4f-6345-4d6f71059346,Know the spread properties technique;/n,,92c927a9-c302-30ed-60be-9d150e19ba18,6954c459-fabf-eae8-1ffb-be7dafe2f377,b120d1e9-8211-02b0-e355-ebc6d29ea5c2
d4fe820e-4373-019f-a592-fbb88fa359b8,Know the build-in Object methods:/n  0) hasOwnProperty  1) isPrototypeOf  2) assign  3) create  4) defineProperty/Properties  5) entries  6) freeze  7) fromEntries,,92c927a9-c302-30ed-60be-9d150e19ba18,6954c459-fabf-eae8-1ffb-be7dafe2f377,b120d1e9-8211-02b0-e355-ebc6d29ea5c2
918fad69-0f5f-399c-0189-1cac87e9d7c0,Know the structure of class expression / declaration and the application of each member:/n  0) getters/setters  1) super  2) this  3) instanceof  4) class field  5) constructor  6) extends  7) static  8) private members  9) class extension prohibition,,92c927a9-c302-30ed-60be-9d150e19ba18,6954c459-fabf-eae8-1ffb-be7dafe2f377,b120d1e9-8211-02b0-e355-ebc6d29ea5c2
1cea9476-3b52-86d5-45d6-a25fd91068c8,"Understand what is a prototype mutation, monkey patching;/n",,305ae917-827f-c61a-7b1f-048f91566865,6954c459-fabf-eae8-1ffb-be7dafe2f377,b120d1e9-8211-02b0-e355-ebc6d29ea5c2
efdcaf01-7012-6964-5f79-b4426954dddf,Know the OOP emulation patterns in ES5;/n,,305ae917-827f-c61a-7b1f-048f91566865,6954c459-fabf-eae8-1ffb-be7dafe2f377,b120d1e9-8211-02b0-e355-ebc6d29ea5c2
8c358592-2db1-1c2a-51b4-200bd8edbfdd,Be aware of “new.target” pseudo-property;/n,,aa885dc1-b321-f8bb-b442-fb1b99ec8fd6,6954c459-fabf-eae8-1ffb-be7dafe2f377,b120d1e9-8211-02b0-e355-ebc6d29ea5c2
47a5b355-1200-c694-4121-2ab7bd11cd02,Understand the try / catch / finally statement and the mechanism behind it;/n,,92c927a9-c302-30ed-60be-9d150e19ba18,6954c459-fabf-eae8-1ffb-be7dafe2f377,28de4294-0fcf-88bd-e18d-7d72cc218a19
18e50e1f-8f5c-86b2-b7e5-66990a7c4093,Know throw keyword and its purpose;/n,,92c927a9-c302-30ed-60be-9d150e19ba18,6954c459-fabf-eae8-1ffb-be7dafe2f377,28de4294-0fcf-88bd-e18d-7d72cc218a19
c62eba4c-3793-84f5-7819-fd812c607b0d,"Know the error object properties, methods and how it can be useful;/n",,92c927a9-c302-30ed-60be-9d150e19ba18,6954c459-fabf-eae8-1ffb-be7dafe2f377,28de4294-0fcf-88bd-e18d-7d72cc218a19
01d835e9-b20d-e6ee-8067-80f49bd58a3f,Be aware of the common standard errors;/n,,92c927a9-c302-30ed-60be-9d150e19ba18,6954c459-fabf-eae8-1ffb-be7dafe2f377,28de4294-0fcf-88bd-e18d-7d72cc218a19
9441fad5-a4d2-e3b3-6afe-8aad830b66ae,"Know the possibility to define custom errors, understand the reason behind it;/n",,92c927a9-c302-30ed-60be-9d150e19ba18,6954c459-fabf-eae8-1ffb-be7dafe2f377,28de4294-0fcf-88bd-e18d-7d72cc218a19
3ec4ccd9-f007-4c89-f3a4-49373e03e345,Understand how errors are propagated across the call stack;/n,,92c927a9-c302-30ed-60be-9d150e19ba18,6954c459-fabf-eae8-1ffb-be7dafe2f377,28de4294-0fcf-88bd-e18d-7d72cc218a19
9a039200-ffc5-93cd-86a4-910492fed2b7,Know the common error handling patterns & practices;/n,,305ae917-827f-c61a-7b1f-048f91566865,6954c459-fabf-eae8-1ffb-be7dafe2f377,28de4294-0fcf-88bd-e18d-7d72cc218a19
d46f5a57-5fac-88ae-ef05-e7ceaa95e15e,Understand the performance issues caused by error handling;/n,,305ae917-827f-c61a-7b1f-048f91566865,6954c459-fabf-eae8-1ffb-be7dafe2f377,28de4294-0fcf-88bd-e18d-7d72cc218a19
45193b8c-b557-d55f-b6e8-a75f17b14027,Know the basics of regular expressions and which types of tasks can be covered by them;/n,,92c927a9-c302-30ed-60be-9d150e19ba18,6954c459-fabf-eae8-1ffb-be7dafe2f377,c46c406b-6552-434b-36fe-7cca91ce2d63
3ecfd428-5770-87f3-c883-4d1d9f4b6993,"Know the JS modules concept, various techniques to organize modularization;/n",,92c927a9-c302-30ed-60be-9d150e19ba18,6954c459-fabf-eae8-1ffb-be7dafe2f377,c46c406b-6552-434b-36fe-7cca91ce2d63
8d6104cb-0051-24e6-23d9-a02b9dedb00f,"Know what does strict mode do, which limitations and improvements it brings to developers;/n",,92c927a9-c302-30ed-60be-9d150e19ba18,6954c459-fabf-eae8-1ffb-be7dafe2f377,c46c406b-6552-434b-36fe-7cca91ce2d63
9de8c7f2-f92a-9980-dff0-aaa2bffd0823,Understand how the JS script is executed & control flow is structured;/n,,305ae917-827f-c61a-7b1f-048f91566865,6954c459-fabf-eae8-1ffb-be7dafe2f377,c46c406b-6552-434b-36fe-7cca91ce2d63
fb4d10ec-e5bf-15a0-2867-8de5c2ba3575,Understand how garbage collection works and how developer can influence on it;/n,,305ae917-827f-c61a-7b1f-048f91566865,6954c459-fabf-eae8-1ffb-be7dafe2f377,c46c406b-6552-434b-36fe-7cca91ce2d63
1603d267-3112-6cf5-cfe8-0085cdc4221e,Understand the memory management mechanisms when running the JS script;/n,,aa885dc1-b321-f8bb-b442-fb1b99ec8fd6,6954c459-fabf-eae8-1ffb-be7dafe2f377,c46c406b-6552-434b-36fe-7cca91ce2d63
54abdaba-c1bc-7dd4-6312-fa7285da2652,Understand the mark-and-sweep algorithm (in memory management);/n,,aa885dc1-b321-f8bb-b442-fb1b99ec8fd6,6954c459-fabf-eae8-1ffb-be7dafe2f377,c46c406b-6552-434b-36fe-7cca91ce2d63
4c7e9c60-a79a-1524-1da0-4e06ea82f3c6,Know the advanced techniques of regular expressions;/n,,aa885dc1-b321-f8bb-b442-fb1b99ec8fd6,6954c459-fabf-eae8-1ffb-be7dafe2f377,c46c406b-6552-434b-36fe-7cca91ce2d63
8774a5af-a5e1-59c0-736e-9a9545af5706,"Understand the HTML document structure, the tree concept;/n",,92c927a9-c302-30ed-60be-9d150e19ba18,21496f8a-399e-039f-24ac-d8eedafb6b4e,373553b5-6f08-5d21-d3da-a28275134aba
701e6ede-5574-926c-9e1d-d76c4890cb9c,Be aware of how whitespaces are handled in DOM;/n,,92c927a9-c302-30ed-60be-9d150e19ba18,21496f8a-399e-039f-24ac-d8eedafb6b4e,373553b5-6f08-5d21-d3da-a28275134aba
cf8c8e23-5691-bb84-4634-952f0cbf39d0,Be aware of HTML entities;/n,,92c927a9-c302-30ed-60be-9d150e19ba18,21496f8a-399e-039f-24ac-d8eedafb6b4e,373553b5-6f08-5d21-d3da-a28275134aba
ed74f79d-d6e4-2338-bfa9-07e47b05ac13,"Know the various DOM elements content types, text nodes;/n",,92c927a9-c302-30ed-60be-9d150e19ba18,21496f8a-399e-039f-24ac-d8eedafb6b4e,373553b5-6f08-5d21-d3da-a28275134aba
0e2241e6-c7fb-23ef-edac-e459bd91d957,Know how to traverse the DOM;/n,,92c927a9-c302-30ed-60be-9d150e19ba18,21496f8a-399e-039f-24ac-d8eedafb6b4e,373553b5-6f08-5d21-d3da-a28275134aba
59291e35-3859-d8c0-6bed-088ffa64561e,"Know how to retrieve elements from DOM, selectors;/n",,92c927a9-c302-30ed-60be-9d150e19ba18,21496f8a-399e-039f-24ac-d8eedafb6b4e,373553b5-6f08-5d21-d3da-a28275134aba
126d9084-86b3-5f99-9db0-b403bce24667,Know how to alter DOM elements;/n,,92c927a9-c302-30ed-60be-9d150e19ba18,21496f8a-399e-039f-24ac-d8eedafb6b4e,373553b5-6f08-5d21-d3da-a28275134aba
58a58b07-b4f7-9102-316d-cbfd1c7a127d,Know how to create DOM elements;/n,,92c927a9-c302-30ed-60be-9d150e19ba18,21496f8a-399e-039f-24ac-d8eedafb6b4e,373553b5-6f08-5d21-d3da-a28275134aba
8c9d3601-5f14-d5e8-668c-0fe5949088fb,"Know how to modify attributes, styles, CSS;/n",,92c927a9-c302-30ed-60be-9d150e19ba18,21496f8a-399e-039f-24ac-d8eedafb6b4e,373553b5-6f08-5d21-d3da-a28275134aba
7325f0f5-c812-c3fa-21cf-7724085a8067,Know how to work with positioning & animation;/n,,92c927a9-c302-30ed-60be-9d150e19ba18,21496f8a-399e-039f-24ac-d8eedafb6b4e,373553b5-6f08-5d21-d3da-a28275134aba
47863dcc-4f70-90f4-4a97-6b9b704f10a2,Be aware of content editability feature;/n,,92c927a9-c302-30ed-60be-9d150e19ba18,21496f8a-399e-039f-24ac-d8eedafb6b4e,373553b5-6f08-5d21-d3da-a28275134aba
9d8c8d90-a301-221a-08c9-5319b263823f,"Know the form elements, purpose of each;/n",,92c927a9-c302-30ed-60be-9d150e19ba18,21496f8a-399e-039f-24ac-d8eedafb6b4e,373553b5-6f08-5d21-d3da-a28275134aba
7dae5628-e64b-8d18-e26e-92907f0fbd6a,Know what is a Document Fragment and its purpose;/n,,305ae917-827f-c61a-7b1f-048f91566865,21496f8a-399e-039f-24ac-d8eedafb6b4e,373553b5-6f08-5d21-d3da-a28275134aba
7b793b65-a7c4-a87e-5cd3-820d748a07ed,Understand how to work with geometry of a document & scrolling;/n,,305ae917-827f-c61a-7b1f-048f91566865,21496f8a-399e-039f-24ac-d8eedafb6b4e,373553b5-6f08-5d21-d3da-a28275134aba
5439eac1-5ad0-f9b7-7e87-7cba4ec3ebec,Understand the concepts behind text selection API;/n,,305ae917-827f-c61a-7b1f-048f91566865,21496f8a-399e-039f-24ac-d8eedafb6b4e,373553b5-6f08-5d21-d3da-a28275134aba
342bcca3-7ee4-0d87-4066-c1eaa835ff96,Know what is Shadow DOM and its purpose;/n,,aa885dc1-b321-f8bb-b442-fb1b99ec8fd6,21496f8a-399e-039f-24ac-d8eedafb6b4e,373553b5-6f08-5d21-d3da-a28275134aba
6e04a4ad-fc07-22c1-be88-e83a75efd4b2,Know the Intersection Observer API;/n,,aa885dc1-b321-f8bb-b442-fb1b99ec8fd6,21496f8a-399e-039f-24ac-d8eedafb6b4e,373553b5-6f08-5d21-d3da-a28275134aba
c8fbe617-a168-37ae-5b57-6607e7df2fd8,Know the browser event types (basic):/n  0) Network events  1) Focus events  2) Form events  3) Keyboard events  4) Mouse events  5) Drag & Drop events  6) Document load,,92c927a9-c302-30ed-60be-9d150e19ba18,21496f8a-399e-039f-24ac-d8eedafb6b4e,32129cc4-3ff8-ba65-f71f-a068d570a6ee
803f6265-b33c-faa9-f6b0-cda477e7da28,Know the ways of events registering;/n,,92c927a9-c302-30ed-60be-9d150e19ba18,21496f8a-399e-039f-24ac-d8eedafb6b4e,32129cc4-3ff8-ba65-f71f-a068d570a6ee
40bca4cb-9e2a-9f37-0d70-98c7280f01bf,Know the events firing mechanism:/n  0) Argument  1) Context  2) Returning value of event handlers  3) Calling precedence   4) Event propagation (stopPropagation / stopImmediatePropagation)  5) Event canceling  6) Default actions,,92c927a9-c302-30ed-60be-9d150e19ba18,21496f8a-399e-039f-24ac-d8eedafb6b4e,32129cc4-3ff8-ba65-f71f-a068d570a6ee
f33ecb0b-abb9-499f-b3f1-0ec1aa55526b,Know the throttling technique and the situations when it is useful;/n,,305ae917-827f-c61a-7b1f-048f91566865,21496f8a-399e-039f-24ac-d8eedafb6b4e,32129cc4-3ff8-ba65-f71f-a068d570a6ee
21552c74-9fa9-786e-f01d-1fecd416a4fd,Know the performance aspects of events handling;/n,,305ae917-827f-c61a-7b1f-048f91566865,21496f8a-399e-039f-24ac-d8eedafb6b4e,32129cc4-3ff8-ba65-f71f-a068d570a6ee
f9fc8d69-e345-981e-9932-e886e8b69b07,Ability to describe the event delegation concept./n,,305ae917-827f-c61a-7b1f-048f91566865,21496f8a-399e-039f-24ac-d8eedafb6b4e,32129cc4-3ff8-ba65-f71f-a068d570a6ee
db0780e1-df00-eb89-9c40-de04b8e2af6c,Know the difference between target & currentTarget./n,,305ae917-827f-c61a-7b1f-048f91566865,21496f8a-399e-039f-24ac-d8eedafb6b4e,32129cc4-3ff8-ba65-f71f-a068d570a6ee
63805ed6-ced5-7a1f-8a20-2f1c27195e80,Know the 3rd parameter of addEventListener:/n  0) capture  1) once  2) passive,,305ae917-827f-c61a-7b1f-048f91566865,21496f8a-399e-039f-24ac-d8eedafb6b4e,32129cc4-3ff8-ba65-f71f-a068d570a6ee
5a1e2b53-2e65-b2e5-c3d6-c6c5ffde23bb,Know the browser event types (advanced):/n  0) Progress events  1) Resource events  2) WebSocket events  3) CSS animation events  4) CSS Transition events  5) Printing events  6) Text composition events  7) View events  8) Session history events  9) Clipboard events  10) Media events  11) Storage events  12) Value change events  13) WebVR events,,aa885dc1-b321-f8bb-b442-fb1b99ec8fd6,21496f8a-399e-039f-24ac-d8eedafb6b4e,32129cc4-3ff8-ba65-f71f-a068d570a6ee
0264f705-69f4-d1e6-c020-b6f0be6f40a6,Know how XMLHttpRequest / FormData work/n,,92c927a9-c302-30ed-60be-9d150e19ba18,21496f8a-399e-039f-24ac-d8eedafb6b4e,efb7727e-695f-e90e-6237-9f3baf4388ab
041317bd-5a89-9b9f-2f98-f7662404afe0,Know how fetch works;/n,,92c927a9-c302-30ed-60be-9d150e19ba18,21496f8a-399e-039f-24ac-d8eedafb6b4e,efb7727e-695f-e90e-6237-9f3baf4388ab
daeb2a25-cf47-c4d8-af2b-38cad1b542d5,Know how WebSocket works;/n,,92c927a9-c302-30ed-60be-9d150e19ba18,21496f8a-399e-039f-24ac-d8eedafb6b4e,efb7727e-695f-e90e-6237-9f3baf4388ab
afd0372a-5dbd-5f30-5ea0-7e3c4aa49141,Ability to describe in which situation a certain networking technique should be used;/n,,92c927a9-c302-30ed-60be-9d150e19ba18,21496f8a-399e-039f-24ac-d8eedafb6b4e,efb7727e-695f-e90e-6237-9f3baf4388ab
cd1013d5-3a73-5548-280e-87d56143d4e7,Know the patterns of network traffic minimization;/n,,305ae917-827f-c61a-7b1f-048f91566865,21496f8a-399e-039f-24ac-d8eedafb6b4e,efb7727e-695f-e90e-6237-9f3baf4388ab
743f55fc-b58a-ee16-771f-ae63a089af83,Be aware of offline apps techniques;/n,,305ae917-827f-c61a-7b1f-048f91566865,21496f8a-399e-039f-24ac-d8eedafb6b4e,efb7727e-695f-e90e-6237-9f3baf4388ab
d001b280-2193-91af-d9a4-9e689ce12b69,"Know how to work with localStorage, sessionStorage (Storage API), their limitations and purpose;/n",,92c927a9-c302-30ed-60be-9d150e19ba18,21496f8a-399e-039f-24ac-d8eedafb6b4e,c67b6971-5bb4-6f06-a342-d5f4f2044d65
84664172-547c-e065-0445-84842bf3e792,"Know what are the cookies, their purpose, common use cases and how to work with them;/n",,92c927a9-c302-30ed-60be-9d150e19ba18,21496f8a-399e-039f-24ac-d8eedafb6b4e,c67b6971-5bb4-6f06-a342-d5f4f2044d65
ced0745a-b48f-3efa-e2d8-bfd0f15fafba,Know the techniques of big data storage on the client side. Common use cases;/n,,aa885dc1-b321-f8bb-b442-fb1b99ec8fd6,21496f8a-399e-039f-24ac-d8eedafb6b4e,c67b6971-5bb4-6f06-a342-d5f4f2044d65
2fa26eb3-44b8-99d8-4a56-7d99bfdc017a,Know the browser’s APIs/interfaces (basic):/n  0) Window object  1) Timers  2) History  3) Location  4) Navigator  5) Screen  6) Working with windows & frames  7) File API,,92c927a9-c302-30ed-60be-9d150e19ba18,21496f8a-399e-039f-24ac-d8eedafb6b4e,af5d4d04-fd76-7f99-c871-2a9ab91af789
c553c9fc-37d1-8715-bc90-f5478beacc67,"Know the browser’s APIs/interfaces (advanced):/n  0) Threads, web workers:  1) Dialogs  2) Canvas  3) Audio/Video  4) SVG  5) Geopositioning  6) Client-side DBs  7) Device/Screen orientations  8) Ambient Light Sensor  9) Proximity API  10) Vibration API  11) Pointer Lock API  12) Web RTC  13) Payment request",,aa885dc1-b321-f8bb-b442-fb1b99ec8fd6,21496f8a-399e-039f-24ac-d8eedafb6b4e,af5d4d04-fd76-7f99-c871-2a9ab91af789
f8760804-148c-81d3-f512-f7de9be1570b,Know how to connect JSundefinedinto HTML website;/n,,92c927a9-c302-30ed-60be-9d150e19ba18,21496f8a-399e-039f-24ac-d8eedafb6b4e,c6445983-c02c-ee8b-c99f-ca99eff5d52e
fc03e116-0969-6cfa-ed08-91beafc9eaf6,Understand what is line terminations (line endings) LF/CRLF and what problems can occur because of negligence;/n,,92c927a9-c302-30ed-60be-9d150e19ba18,21496f8a-399e-039f-24ac-d8eedafb6b4e,c6445983-c02c-ee8b-c99f-ca99eff5d52e
50d3a256-5738-b77f-0a33-c995e709877d,Know the tips for fast-loading of HTML pages:/n  0) Reduce page weight.  1) Minimize the number of files.  2) Use a CDN.  3) Reduce domain lookups.  4) Cache reused content.  5) Page components ordering optimally.  6) Content chunking.  7) Images minimizing & compression.  8) Prevent reflow via size specification for images & tables.  9) Lazy loading for images.  10) Async & defer usage.,,305ae917-827f-c61a-7b1f-048f91566865,21496f8a-399e-039f-24ac-d8eedafb6b4e,c6445983-c02c-ee8b-c99f-ca99eff5d52e
f28916f9-2c45-7765-ff40-62cac464a9f2,Understand the PWA concept;/n,,aa885dc1-b321-f8bb-b442-fb1b99ec8fd6,21496f8a-399e-039f-24ac-d8eedafb6b4e,c6445983-c02c-ee8b-c99f-ca99eff5d52e
302e7800-c161-583c-dad9-ea087cda3eeb,"Know what a Service Metadata Document is, its purpose./n",,ada90e4e-7353-4533-f414-c329f3a0f8f0,a2692f42-63d2-fa84-98fc-7273cbb0e056,798b3586-58c8-db79-3d42-af69cdcb5b3b
a69024e0-bb08-7443-fe68-e73575c29e65,"Know the aspects of Entity Data Model (EDM), ability to explain and name the purpose of each:/n  0) Entity Type.  1) Entity.  2) Entity Key.  3) Entity Set.  4) Association.  5) Association Set.  6) Navigation Property.  7) Function Import.",,ada90e4e-7353-4533-f414-c329f3a0f8f0,a2692f42-63d2-fa84-98fc-7273cbb0e056,798b3586-58c8-db79-3d42-af69cdcb5b3b
e25193ae-1806-cba2-ae97-8559c332d4e4,"Know the Primitive Data Types, their expected format in request and purpose / use cases:/n  0) Edm.Boolean.  1) Edm.Decimal.  2) Edm.DateTime.  3) Be aware of two kinds of Types:",,ada90e4e-7353-4533-f414-c329f3a0f8f0,a2692f42-63d2-fa84-98fc-7273cbb0e056,798b3586-58c8-db79-3d42-af69cdcb5b3b
fedc04dd-8802-37d5-408c-47c7c6f82f73,Be acquainted with OData ;/n,,ada90e4e-7353-4533-f414-c329f3a0f8f0,a2692f42-63d2-fa84-98fc-7273cbb0e056,798b3586-58c8-db79-3d42-af69cdcb5b3b
7464a7f7-f381-096c-38e7-18b5cc1442f2,"Know the aspects of Entity Data Model (EDM), ability to explain and name the purpose of each:/n  0) Complex Type.  1) Entity Container.",,92c927a9-c302-30ed-60be-9d150e19ba18,a2692f42-63d2-fa84-98fc-7273cbb0e056,798b3586-58c8-db79-3d42-af69cdcb5b3b
7f436493-c4a4-15ca-20fa-46a15e584c75,"Know the Primitive Data Types, their expected format in request and purpose / use cases:/n  0) Edm.DateTimeOffset.  1) Edm.Guid.  2) Edm.Binary.  3) Edm.Byte.  4) Edm.Double.  5) Edm.Single.  6) Edm.Int16.  7) Edm.Int32.  8) Edm.Int64.  9) Edm.SByte.  10) Edm.Time.  11) Null.",,92c927a9-c302-30ed-60be-9d150e19ba18,a2692f42-63d2-fa84-98fc-7273cbb0e056,798b3586-58c8-db79-3d42-af69cdcb5b3b
3a45c7b3-59c6-5683-1753-44a0d328e890,"Know what a Service Document is, its purpose./n",,305ae917-827f-c61a-7b1f-048f91566865,a2692f42-63d2-fa84-98fc-7273cbb0e056,798b3586-58c8-db79-3d42-af69cdcb5b3b
6e534e19-0bdc-dd7a-0c51-d1ba2dde30ee,Know the main components of the OData URI: /n  0) Scheme.  1) Host.  2) Port.  3) ServiceRoot.  4) ResourcePath.  5) QueryOptions.,,ada90e4e-7353-4533-f414-c329f3a0f8f0,a2692f42-63d2-fa84-98fc-7273cbb0e056,041880b1-a492-1e22-2fcf-c8b62e175a6b
f03e46a2-3d59-63a4-598c-d93e90572988,Know the resource path aspects:/n  0) Addressing the entities:  1) Addressing service operations (functional imports).,,ada90e4e-7353-4533-f414-c329f3a0f8f0,a2692f42-63d2-fa84-98fc-7273cbb0e056,041880b1-a492-1e22-2fcf-c8b62e175a6b
d776bbe1-3431-bfab-9596-695036501acb,Know the query options aspects:/n  0) System query options:  1) Service operation (a.k.a Function Import) parameters.,,ada90e4e-7353-4533-f414-c329f3a0f8f0,a2692f42-63d2-fa84-98fc-7273cbb0e056,041880b1-a492-1e22-2fcf-c8b62e175a6b
17dd296c-e7c5-6d44-b920-e0065a44ab13,Know the resource path aspects:/n  0) Addressing links between entries.,,92c927a9-c302-30ed-60be-9d150e19ba18,a2692f42-63d2-fa84-98fc-7273cbb0e056,041880b1-a492-1e22-2fcf-c8b62e175a6b
4b44017c-2894-e459-f0cc-65446182ab05,Know the query options aspects:/n  0) System query options:  1) Custom query options.,,92c927a9-c302-30ed-60be-9d150e19ba18,a2692f42-63d2-fa84-98fc-7273cbb0e056,041880b1-a492-1e22-2fcf-c8b62e175a6b
552bcd12-549e-162c-72cc-a02a26c46854,Know how to retrieve collections./n,,ada90e4e-7353-4533-f414-c329f3a0f8f0,a2692f42-63d2-fa84-98fc-7273cbb0e056,0d58feb4-a046-a7f0-b26a-46eac8fea7cf
58ebed14-6027-00bb-e7f0-afc46f552811,Know how to retrieve individualundefinedproperties./n,,ada90e4e-7353-4533-f414-c329f3a0f8f0,a2692f42-63d2-fa84-98fc-7273cbb0e056,0d58feb4-a046-a7f0-b26a-46eac8fea7cf
7fac415d-203b-2265-b5a3-1b294a588d41,Know how to retrieve the metadata document./n,,ada90e4e-7353-4533-f414-c329f3a0f8f0,a2692f42-63d2-fa84-98fc-7273cbb0e056,0d58feb4-a046-a7f0-b26a-46eac8fea7cf
08a8a199-320e-8bca-b5a4-39cec6ca3deb,Know how to perform CRUD operations:/n  0) Create new Entries;  1) Read entities;  2) Update entries;  3) Update individual properties;  4) Delete entries;,,ada90e4e-7353-4533-f414-c329f3a0f8f0,a2692f42-63d2-fa84-98fc-7273cbb0e056,0d58feb4-a046-a7f0-b26a-46eac8fea7cf
911620c8-775d-d952-4c7f-a34dc3bc7e98,Know how to invoke service operations (a.k.a Function Import)./n,,ada90e4e-7353-4533-f414-c329f3a0f8f0,a2692f42-63d2-fa84-98fc-7273cbb0e056,0d58feb4-a046-a7f0-b26a-46eac8fea7cf
c5784020-7643-f2ed-fc61-e808e3f42628,Know how to retrieve an individual property raw value./n,,92c927a9-c302-30ed-60be-9d150e19ba18,a2692f42-63d2-fa84-98fc-7273cbb0e056,0d58feb4-a046-a7f0-b26a-46eac8fea7cf
dd44a506-be82-d21c-fb43-1643c8a54da8,Understand what batch processing is and what benefits it brings./n,,ada90e4e-7353-4533-f414-c329f3a0f8f0,a2692f42-63d2-fa84-98fc-7273cbb0e056,25da02e3-55dd-112d-f6bd-efd3c5d17195
8758e01f-7871-65cc-6625-c59b956f523f,Know the batch request HTTP headers aspects./n,,92c927a9-c302-30ed-60be-9d150e19ba18,a2692f42-63d2-fa84-98fc-7273cbb0e056,25da02e3-55dd-112d-f6bd-efd3c5d17195
